{
  "$schema": "https://json-schema.org/draft/2020-12/schema",
  "$id": "media_reference.schema.json",
  "title": "MediaReference",
  "type": "object",
  "additionalProperties": false,
  "required": [
    "source_asset_id",
    "storage",
    "sha256",
    "clip",
    "dimensions",
    "frame_map"
  ],
  "properties": {
    "source_asset_id": {
      "type": "string"
    },
    "storage": {
      "type": "object",
      "additionalProperties": false,
      "required": [
        "bucket",
        "key"
      ],
      "properties": {
        "bucket": {
          "type": "string"
        },
        "key": {
          "type": "string"
        },
        "version_id": {
          "type": [
            "string",
            "null"
          ]
        }
      }
    },
    "sha256": {
      "type": "string",
      "pattern": "^[0-9a-f]{64}$"
    },
    "clip": {
      "type": "object",
      "additionalProperties": false,
      "required": [
        "start_offset_s",
        "duration_s"
      ],
      "properties": {
        "start_offset_s": {
          "type": "number",
          "minimum": 0
        },
        "duration_s": {
          "type": "number",
          "exclusiveMinimum": 0
        }
      }
    },
    "dimensions": {
      "type": "object",
      "additionalProperties": false,
      "required": [
        "width",
        "height"
      ],
      "properties": {
        "width": {
          "type": "integer",
          "minimum": 1
        },
        "height": {
          "type": "integer",
          "minimum": 1
        }
      }
    },
    "frame_map": {
      "$ref": "frame_map.schema.json"
    },
    "telemetry": {
      "type": "object",
      "additionalProperties": false,
      "required": [
        "status"
      ],
      "properties": {
        "status": {
          "enum": [
            "aligned",
            "unaligned",
            "missing"
          ]
        },
        "reason": {
          "type": [
            "string",
            "null"
          ]
        },
        "srt_sha256": {
          "oneOf": [
            {
              "type": "string",
              "pattern": "^[0-9a-f]{64}$"
            },
            {
              "type": "null"
            }
          ]
        }
      }
    }
  }
}
